{
  "$schema": "http://json-schema.org/draft-04/schema#",
  "id": "http://cpp.moj.gov.uk/sjp/json/schema/event/public.events.sjp.case-referred-to-court.json",
  "type": "object",
  "properties": {
    "decisionId": {
      "$ref": "http://justice.gov.uk/domain/core/common/definitions.json#/definitions/uuid"
    },
    "sessionId": {
      "$ref": "http://justice.gov.uk/domain/core/common/definitions.json#/definitions/uuid"
    },
    "caseId": {
      "$ref": "http://justice.gov.uk/domain/core/common/definitions.json#/definitions/uuid"
    },
    "urn": {
      "type": "string"
    },
    "defendantId": {
      "$ref": "http://justice.gov.uk/domain/core/common/definitions.json#/definitions/uuid"
    },
    "defendantName": {
      "type": "string"
    },
    "savedAt": {
      "$ref": "http://justice.gov.uk/json/schemas/domains/sjp/temporal.json#/definitions/date-time"
    },
    "offenceDecisions": {
      "$ref": "http://cpp.moj.gov.uk/core/sjp/decision/offenceDecisions.json"
    },
    "financialImposition": {
      "$ref": "http://cpp.moj.gov.uk/core/sjp/decision/financial-imposition/financialImposition.json"
    }
  },
  "required": [
    "decisionId",
    "sessionId",
    "caseId",
    "savedAt",
    "offenceDecisions"
  ],
  "additionalProperties": false
}